[
  {
    "review_id": "reference-v08-harvard-cs50x",
    "course_id": "harvard-cs50x",
    "reviewed_on": "2026-09-14",
    "reconciliation_record": "docs/qa-reference-reconciliation-v0.5.md",
    "canonical_url": "https://cs50.harvard.edu/x/",
    "observed_free_access": "F0_FULL_CREDENTIAL",
    "observed_status": "active",
    "instruction_languages": [
      "en"
    ],
    "subtitle_languages": [],
    "credential": "Free CS50 Certificate is available after meeting the course completion threshold; the optional edX verified certificate is separate and paid.",
    "academic_credits": "No academic credit through the free OCW route; separate Harvard Extension/Summer enrollment may carry paid academic credit.",
    "self_paced": true,
    "scope_notes": "Broad introduction to computer science covering C, memory, data structures, algorithms, Python, SQL, web foundations and a final project.",
    "prerequisites": "No prior programming experience is required; the course is designed as an introduction to computer science.",
    "required_resources": "Modern browser and free edX account for submission/feedback; CS50's cloud development environment removes paid local tooling requirements.",
    "component_evidence": {
      "pedagogy": "A coherent concept-first sequence moves from low-level computing into higher-level programming and web work, then culminates in an open-ended final project.",
      "depth": "The course develops broad CS foundations beyond syntax, including memory, algorithms, data structures, databases and software construction.",
      "practice": "Demanding problem sets, labs and the final project require repeated implementation rather than passive viewing.",
      "materials": "Lectures, notes, shorts, problem specifications, tooling and reference material form a strong self-study package.",
      "currency": "The live 2026 route is actively maintained; examples and tooling are current while the core CS concepts are durable.",
      "expertise": "CS50 is taught and maintained by Harvard instructors and staff with long-running subject and curriculum expertise.",
      "accessibility": "The educational path and provider certificate are free, but successful completion still requires substantial time and an account for submissions."
    },
    "prior_quality_components": {
      "pedagogy": 10,
      "depth": 9.6,
      "practice": 9.9,
      "materials": 10,
      "currency": 10,
      "expertise": 10,
      "accessibility": 9.5
    },
    "prior_quality_score": 9.88,
    "prior_recommendation_score": 9.9,
    "quality_components": {
      "pedagogy": 9.7,
      "depth": 9.5,
      "practice": 9.8,
      "materials": 9.7,
      "currency": 9.8,
      "expertise": 9.8,
      "accessibility": 9.4
    },
    "quality_score": 9.69,
    "recommendation_score": 9.8,
    "recommendation_rationale": "Still the strongest broad beginner CS anchor in the index. The recalibration trims pre-pipeline perfect scores while preserving its category-leading recommendation.",
    "comparators": [
      "nand2tetris",
      "harvard-cs50p"
    ],
    "evidence": [
      "https://cs50.harvard.edu/x/",
      "https://cs50.harvard.edu/x/certificate/"
    ],
    "flags": [
      "reference",
      "cs50",
      "final-project",
      "free-certificate"
    ],
    "calibration_outcome": "recalibrated",
    "is_current": true
  },
  {
    "review_id": "reference-v08-harvard-cs50p",
    "course_id": "harvard-cs50p",
    "reviewed_on": "2026-09-14",
    "reconciliation_record": "docs/qa-reference-reconciliation-v0.5.md",
    "canonical_url": "https://cs50.harvard.edu/python/",
    "observed_free_access": "F0_FULL_CREDENTIAL",
    "observed_status": "active",
    "instruction_languages": [
      "en"
    ],
    "subtitle_languages": [],
    "credential": "Free CS50 Certificate is available after meeting completion requirements; an optional edX verified certificate is separate and paid.",
    "academic_credits": "No academic credit is verified through the free course route.",
    "self_paced": true,
    "scope_notes": "Python-focused introduction covering functions, conditionals, loops, exceptions, libraries, unit tests, file I/O, regular expressions, object-oriented programming and a final project.",
    "prerequisites": "No prior programming experience is required.",
    "required_resources": "Modern browser and free edX account for submissions; exercises can be completed with the provided CS50 development environment.",
    "component_evidence": {
      "pedagogy": "The weekly sequence introduces Python concepts in a deliberate progression and connects each topic directly to assessed programming work.",
      "depth": "Strong introductory Python coverage reaches testing, file handling, regular expressions and OOP without becoming a full computer-science curriculum.",
      "practice": "Nine weeks of problem sets plus a final project create unusually high implementation density for an introductory Python course.",
      "materials": "Lectures, notes, problem specifications and the CS50 tooling ecosystem support independent study well.",
      "currency": "The live route remains maintained and uses current Python practice; the subject itself changes more slowly than framework-driven software courses.",
      "expertise": "Harvard's CS50 teaching team has deep experience delivering programming education at scale.",
      "accessibility": "The course and CS50 certificate are free and browser-accessible, with modest account friction and no paid software requirement."
    },
    "prior_quality_components": {
      "pedagogy": 9.9,
      "depth": 9,
      "practice": 9.8,
      "materials": 9.8,
      "currency": 9.8,
      "expertise": 10,
      "accessibility": 9.7
    },
    "prior_quality_score": 9.68,
    "prior_recommendation_score": 9.6,
    "quality_components": {
      "pedagogy": 9.6,
      "depth": 9,
      "practice": 9.7,
      "materials": 9.6,
      "currency": 9.7,
      "expertise": 9.8,
      "accessibility": 9.6
    },
    "quality_score": 9.53,
    "recommendation_score": 9.5,
    "recommendation_rationale": "One of the best structured Python introductions available free; slightly below the pre-pipeline score after calibration against the later evidence scale.",
    "comparators": [
      "helsinki-python-mooc-2026",
      "harvard-cs50x"
    ],
    "evidence": [
      "https://cs50.harvard.edu/python/",
      "https://cs50.harvard.edu/python/certificate/"
    ],
    "flags": [
      "reference",
      "python",
      "final-project",
      "free-certificate"
    ],
    "calibration_outcome": "recalibrated",
    "is_current": true
  },
  {
    "review_id": "reference-v08-harvard-cs50-ai",
    "course_id": "harvard-cs50-ai",
    "reviewed_on": "2026-09-14",
    "reconciliation_record": "docs/qa-reference-reconciliation-v0.5.md",
    "canonical_url": "https://cs50.harvard.edu/ai/",
    "observed_free_access": "F0_FULL_CREDENTIAL",
    "observed_status": "active",
    "instruction_languages": [
      "en"
    ],
    "subtitle_languages": [],
    "credential": "Free CS50 Certificate is available after meeting completion requirements; the optional edX verified certificate is separate and paid.",
    "academic_credits": "No academic credit through the free route; separate paid Harvard enrollment options may carry credit.",
    "self_paced": true,
    "scope_notes": "Project-heavy AI foundation spanning search, knowledge representation, uncertainty, optimisation, machine learning, neural networks and language, with current LLM context.",
    "prerequisites": "CS50x or roughly one year of Python programming experience is expected.",
    "required_resources": "Computer/browser, Python-capable development environment and free edX account for project submission and feedback; no paid API spend is required for the core route.",
    "component_evidence": {
      "pedagogy": "Conceptual AI techniques are repeatedly connected to concrete Python projects, which makes abstract methods operational rather than purely theoretical.",
      "depth": "The course spans classical AI, machine learning, neural networks and language at meaningful undergraduate depth.",
      "practice": "Substantial projects across the syllabus require implementation of algorithms and models rather than quiz-only recall.",
      "materials": "Lectures, notes, project specifications and starter/support code create a strong independent-learning package.",
      "currency": "The live course now acknowledges large language models, but its main value remains foundational AI rather than comprehensive coverage of the fast-moving generative-AI frontier.",
      "expertise": "The Harvard CS50 team combines strong computing pedagogy with a mature maintained course infrastructure.",
      "accessibility": "The course and provider certificate are free, but the Python prerequisite and project workload raise learner friction versus beginner ML routes."
    },
    "prior_quality_components": {
      "pedagogy": 9.8,
      "depth": 9.4,
      "practice": 9.8,
      "materials": 9.7,
      "currency": 9.2,
      "expertise": 10,
      "accessibility": 8.8
    },
    "prior_quality_score": 9.62,
    "prior_recommendation_score": 9.7,
    "quality_components": {
      "pedagogy": 9.6,
      "depth": 9.3,
      "practice": 9.8,
      "materials": 9.6,
      "currency": 9.4,
      "expertise": 9.8,
      "accessibility": 8.8
    },
    "quality_score": 9.54,
    "recommendation_score": 9.5,
    "recommendation_rationale": "Excellent project-based AI foundations and still a top recommendation, but current generative-AI breadth is not deep enough to justify the older near-perfect score.",
    "comparators": [
      "google-ml-crash-course",
      "huggingface-agents-course",
      "openai-agents-workflows"
    ],
    "evidence": [
      "https://cs50.harvard.edu/ai/",
      "https://cs50.harvard.edu/ai/certificate/"
    ],
    "flags": [
      "reference",
      "ai",